"u/patak_js","1 day ago","Vite 3 is out!","No description available"
"u/yst222","2 days ago","Need help with some API settings...","Hi everyone, I'm a UX writer for a foreign company and we've got some API key settings that I need to explain. The problem is, our devs don't speak English, and I'm not a dev. It's like the deaf leading the blind. So I really hope someone can explain this stuff to me."
"u/1chbinamin","2 days ago","How to send push notifications to PWA with Firebase Cloud Messaging without using device tokens or topics?","I'm using Google Cloud Messaging for sending push notifications to client webapp with PWA. I've stumbled across some texts mentioning that you need to provide device tokens (a.k.a. FCM token or registration tokens) inside a server (in my case it's Node.js) from where you want to send push notifications or by using topics. Isn't possible to just ignore using topics or device tokens and just send notifications by URL name for example '/dashboard'? Because '/dashboard' is a protected route in my app so only the logged in user would be able to receive push notifications. Providing a list of tokens before sending push notifications to devices with these same tokens is cumbersome to be honest. I have to save these tokens to a database (Firestore would be best in my scenario) and I always have to fetch these tokens before sending notifications. And if a user reinstalls the PWA, I have to always replace the old token in the database by a newer one."
"u/SleepAffectionate268","2 days ago","What service is the best in terms of price and quality for my project?","I have a ""small"" project in mind where a user can upload a sql file with create table statements. After that the statement gets passed to a according database: mariaDB, mysql, postgreSQ, ...."
"u/Narfi1","2 days ago","Vercel not serving custom error page","Hello."
"u/futureismine888","2 days ago","Conversion Rate Optimization Templates","Hi folks, I am working on a consulting project and will be using google optimize as an AB testing tool on a client's web page. Google optimize has an add html element as a function. My question is this: are there a set of html code library out there that i can use to plug and play to test out different ideas rapidly?"
"u/venediktoff","2 days ago","I have now been a dev for a decade, I want to share a few tips for the ""young"" ones.","No description available"
"u/THEGreatGM20","2 days ago","How to get a free lifetime domain with eu.org","No description available"
"u/feross","2 days ago","A win-win situation","No description available"
"u/chadwell","2 days ago","Questions about microservices","I work on of one of many teams which all feed in to a monolithic application. Its gotten too big and there is a lack of ownership of features. Team are stepping on each others toes. If one team introduces a bug in prod then we may need to roll back the whole app for example."
"u/Artistic_Trip_69","2 days ago","Starting my first Web-dev job tomorrow. Freaking out!","Heck, I never even had an office job. Any tips how to survive and later on - thrive?"
"u/mmaksimovic","2 days ago","Developer Salaries 2022 Report Netherlands","No description available"
"u/fursty_ferret","2 days ago","Any hosting company that isn't a bait-and-switch scum bucket?","Been out of the loop for a while but are there any hosting companies out there that don't do the ""$2/month for 12 months and then $1,250,000 monthly""."
"u/Bwaaahbby","2 days ago","Adding a database to an Apache website","Hello"
"u/Notalabel_4566","2 days ago","What are some ""common knowledge"" rules that you learned a bit late?","Anyone have any funny stories?"
"u/Hi-Mark","2 days ago","Best way to deal with fetched data from an external API?","Hello, I am working on a website, which will fetch a lot of data from various game stores (steam, itch.io, etc.) and then parse it and display it. I am using a python Django backend and Nextjs frontend. They communicate with an API. I want to fetch all games from steam web api and then fetch the information for each of them. The information would be a description, some images, name, and maybe something else but these would be the most important ones."
"u/varg_ass","2 days ago","firefox supports ""backdrop-filter: blur"" now?","using firefox dev edition and bootstraps overlay component suddenly works like its supposed to, is it officially supported now?"
"u/CelticHades","2 days ago","How can I change this(and history) to exact date and time on JIRA on browser?","No description available"
"u/WordyBug","2 days ago","How do companies filter out the developer job applications they receive?","When companies list their positions on public job boards, they'll surely receive tons of applications. I wonder how they filter out those applications. Let's say if a company is hiring for Reactjs frontend developer, how do they determine the competent applicants? how do they determine the programming competency of the applicant in the first place?"
"u/bd-oivxxiii","2 days ago","App working in DEV and PROD environments. But in QA, one button is showing different functionality. What is the solution to look for?","I am working in a project where we have created a Flask application. It contains a few buttons. All the buttons are working as they should in DEV and PROD environments. But in QA environment, one button is showcasing the functionality of a different button."
"u/pinnokeyo","2 days ago","How would you approach designing a system like this?","A bit of a loaded question, but I'll try to simplify as much as I can."
"u/Muck92","2 days ago","REST API or specialised API for app backend?","I am asking myself, whether there is an best practice for designing the endpoints for a backend for a mobile app/web app. Should I create endpoints for specific business objects (REST) or endpoints that returns all data for an specific view in the app. What are the pros and cons?"
"u/RootBeerRaptor","2 days ago","What's A Good Place To Host A Small App For Free?","Probably been asked several times before. But I just want to build a small scale application that lets users post images and create blog posts."
"u/Adminim","2 days ago","Recommendation for how to build a page that has links/buttons and also lets you store your own custom links?","I want to build a simple page for people to visit that has pre-made buttons/links/text and embedded, but also a few sections where they can customize their own links or embedded videos. Is that possible to build easily if I'm not a coder?"
"u/range_et","2 days ago","Best way to create a node libraries with dependencies","Hello! So for a while now I’ve been working on a networkviz library and more recently I’ve wanted to use the library in other projects + some of my work projects. The library itself relies on a bunch of other libraries like Three js /deck gl etc. Hence, I want to bundle it up and push a bundled file on npm I’m a bit confused what the best way to do that is."
"u/Thomassaurus","2 days ago","I have a very specific spot on my web game that I want to put a banner ad, whats my best option?","I have a specific spot on the bottom of my java script game where I want to display banner ads so I can get a small income. I'm asking here because there doesn't seem to be a lot of support that I can find that will answer this question. I've tried adsense which doesn't do games, ezoic which has requirements that I can't figure out, Hilltop Ads which apparently randomly display ads on my site which isn't what I want."
"u/pensivetomatillo","2 days ago","If anyone can help with Google Cloud oauth/API approval process, please help me figure out how to handle this infuriating issue. I am getting repeatedly auto-rejected for something clearly untrue and I'm losing my mind trying to figure out why.","I know this is not the most ideal place to ask but I've already tried the ideal places with no success."
"u/everything_in_sync","2 days ago","In your experience does it matter which MVC you know or is more important to know a MVC?","I'm moving along landed a front end freelancing/contractor job recently. I know enough to figure anything out so far (except for understanding nth-child() in css to inject text when you can't directly access the html). That's the only time I had to ask a senior for help after an hour."
"u/Demon-Souls","2 days ago","I want motivation to get back programming","First, sorry if I'm rising a personal issue here, but I think many of you have faced this issue."
"u/No-Race8789","2 days ago","How to blacklist IP detected by honeypot on the frontend?","I've setup a honeypot on login and signup page, if the honeypot input gets filled up how do I correlate that with the IP address from nginx especially if there are multiple request at the same time?"
"u/skylarheisenberg123","2 days ago","eCommerce or booking?","Hello! I’m fairly new and I am creating a website for an imaginary museum using React/Django. My next step is one of the following:"
"u/OLD_WET_HOLE","2 days ago","Is bootstrap really all that useful with all of the recent updates to CSS?","So I'm learning bootstrap right now and... I'm no CSS master but I'd call myself adept at this point and as someone who's `adept` at CSS bootstrap seems kind of unnecessary? Am I missing some of its use cases or is it a bit outdated ?"
"u/mind_over_machine","2 days ago","What do you charge for functional analysis, architecture, and discovery for a medium size project?","Hey r/webdev,"
"u/EvolvingIntoAHuman","2 days ago","Trustworthy API for live Esports and Gaming data?","I am having a hard time finding a trustworthy API for live gaming data to use in my project."
"u/Unable_Count_1635","2 days ago","Is it normal that my company fetches development data using JSON mock files ONLY?","So normally in development you'd have a development server with trivial data with a /GET OR /POST API route to test am I right? This is what I am used to but ..when I got hired at my new company.. I noticed that there is no actual /GET OR /POST OR ANY API routes at all. We have NO access to a development server. This application was built in 2007 and so I was told that is the only way they could test data back in the day. When we start on a new feature WE the front end are asked to create a large mock json file so backend can write a script to replicate it..it is so annoying. I feel as though, backend should be coming up with the data sets and not the front end but whatever. Essentially I am reading json responses over http for everything. So you may ask, well how does the data get shown in production? We'll we use /mock.json files (POST req) to (GET & POST OUR DATA..I know weird because technically POST returns data) & in production, we have a java engineer who runs a java .do script that switches our /mock.json over to a real /post API route automatically when he runs his server. I'm sorry. I know this all seems super confusing, well it is because it is. The issue is, that I can never test data in real-time. I have to wait til pre-prod is up & we go back and manually test what went wrong with our mock.json files. Is this normal? (BTW WE HAVE NO UNIT TEST IMPLEMENTATION, WE FETCH MOCK JSON FOR GENERAL USE & NOT UNIT TEST)"
"u/r3df0x_3039","2 days ago","Suggestions on where I can get an email account to use with a Lemmy site?","I used to use an account with a personal Mail-in-a-box site, but it has since broken from going out of date and it's not even accessible anymore. I may just create a new MIAB server with a subdomain but until then is there a service I can register an account for that's free?"
"u/purforium","2 days ago","Reject omitting “Reject All”","No description available"
"u/knaps","2 days ago","Help Choosing a Blog Platform?","Hey all,"
"u/mutumbocodes","2 days ago","What is the best way to implement a design file?","Hey r/webdevI am sure we have all run into this at some point. You get a design file from someone - your PM, designer, client, and you have to implement that design in code, how do you do it?"
"u/Autumnlight_02","2 days ago","Which chair to buy as an overweight Dev","Hello everyone, I am currently on the search for a Chair for overweight people. I've got a big budget so money is not the issue. The only issue is that I move quite a lot around and shake usually with a leg. That causes the Chair to break at the centerpiece (between the seat and the rod). I'm currently In the process of losing weight But using a Kitchen chair for two months causes a lot of damage to my back."
"u/hew2702","2 days ago","Should I use a public repo for customer-facing scripts on an enterprise application?","Amateur solo-dev here - I develop Dynamics CRM for an organization and have never actually used git or a repo of any kind. I know that's very bad practice, so I want to get things more in line with how they should be done even if I don't have a team."
"u/queueareste","2 days ago","XMLHTTPRequest works on pc browser but not mobile?","Hello, I'm trying to make an http request to get data from a locally hosted server on my ip. I've tried it on 2 different PCs on my network and its able to retrieve the data with a status of 200. When I try on mobile iOS, I get a status of 0 and no response. I'm connected to the same wifi as my PCs on my phone and I even disabled cellular data for chrome on my mobile device. I downloaded an app called API tester and I'm able to successfully get the data through there. I can even visit the page and see the correct data on the mobile browser. I have iOS 15.5 and am using the mobile chrome browser. The only error I get is 'Error: Failed to recalculate device parameters' then 'Using fallback iOS device measurements' and I'm pretty sure that is unrelated to this specific issue. Any help would be appreciated!"
"u/SleepAffectionate268","2 days ago","What are some more things NOT to implement under any circumstances into a website?","I did some research and found this articel: https://www.sitesnstores.com.au/blog/professional-web-design/20-things-that-should-never-ever-appear-on-your-website"
"u/OrangeJuice123456","2 days ago","Portfolio Ideas","Just looking for some ideas on projects I could work on that would be fun to do and be impressive I guess to any future employers."
"u/ricci2511","2 days ago","Doubting between two internship offers","So next month im starting my internship as a frontend developer, but im unsure about which company offer to take. I have a longer story with the first offer, basically I was supposed to do my internship about 3 months ago, everything seemed to be fine, everyone involved was really kind and eager to get me on board, at least it felt that way to me. But then i had never received any answer, even though it was confirmed that i would start working in their company, i felt like they basically ghosted me. I started looking elsewhere, so after a small interview I got a new offer. So far this new company has great people, but the catch is I was initially told that they were using angular, but no, it turns out they are still using AngularJS. I was really excited to work for them but knowing that I will be working with a framework that is considered legacy and reading about all the criticism/hate for it Im more nervous than excited."
"u/cahaseler","2 days ago","Tools to convert a full stack web application into a locally installable app?","Yes, I know it's *not* how you write local software. The server version is the primary system, and it's finished. Flask, React, PostGreSQL."
"u/Graineon","2 days ago","Legalities surrounding who owns the product with open source software","I'm currently contracted by a group that I work quite passionately for for mobile web app dev. I had a thought come to mind as several aspects of what I was making I could have made open source. For example, I developed a highlighting system that could be implemented in a lot of cases if I were to make it open source."
"u/2SPAC_Shakur","2 days ago","I have been seeing these ""Listen to this article"" widgets on a lot of websites lately and they all look the same aside from some color scheme differences. Does anyone know what service/add-on this is?","No description available"
"u/future_web_dev","2 days ago","What are some of your favorite resources to keep yourself up to date in this industry?","Specifically interested in JavaScript/Python related resources"
"u/inventorofmachines","2 days ago","I need software/framework/workflow AS CLOSE TO THIS as possible [React/Node]","TL;WR version:"
"u/nottherealprotege","2 days ago","Is there a concrete list of requirements for what constitutes as an ADA compliant website?","Like I know there is WCAG but is that synonymous with ADA compliance as far as the law is concerned?"
"u/Justpassinby1984","2 days ago","Portfolio from scratch?","Do you need to build your portfolio from scratch using the skills you learned? Or can you use WordPress or Wix?"
"u/nfsi0","2 days ago","Creating a Web SDK and looking for guidance on how to ""package it up"" so that it's extremely flexible for people to use with whatever web tech stack they are using","I'd like to provide several different ways for my customers to integrate the SDK depending on what they are looking for:"
"u/lynx1581","2 days ago","Help with making webpage into pdf and upload to project??","Im a student ,im trying to develop a scholarship website in asp.net c#. I have made a form page where the user can input his details but i need help with converting the form page into a pdf and save it inside my project folder as a pdf."
"u/mrbogle","2 days ago","Atomic CSS-in-JS: twind","No description available"
"u/GuerroCanelo","2 days ago","Is there a reason why developers purposely misspell words?","I’m a new dev and I noticed that several developers misspell class names, variable names, etc. and it’s almost like it’s done on purpose."
"u/fyzbo","2 days ago","How do you define JAMStack?","I was sure I had a strong definition of JAMStack and what defines a JAMStack website, but I see it used in many other ways. So I'm asking the community, what is your definition of JAMStack? How does it differ from other web technologies including:"
"u/Elliot40404","2 days ago","A cli tool written in golang to easily manage startup apps on windows","https://github.com/elliot40404/starman"
"u/younissit","2 days ago","I need help with WordPress and PHP coding please anyone?","https://gist.github.com/younesmukhtar/aded015d38b9e73d0bdb74b6062a02f5"
"u/turbochamp","2 days ago","Is this frontend assessment from PayPal legit?","So I did apply to a frontend job at PayPal, but this email (actually 2 emails) I received a few days later seems a little suspect."
"u/razerroth","2 days ago","What's a good JS library for handling the quiz portion (grading, etc.) of an e-learning web application (needs to have multi-language support)?","I'm a web developer and looking to build a simple e-learning web application that will have a series of graded tests and a ""course"" that's really just some videos and stuff to read before taking some tests. There are about 40 different quizes and prep material in total. It will be a custom web application (I already have the skills to do this from complete scratch) , but I'm looking a library / framework that has the grading and internationalization (multi-lingual support) included. There is no value for me in creating that part of it if a library can handle it for me. Language wise, I'd prefer to do the front-end in JS and maybe use a framework like Next.js, but I'm less concerned with the tech stack at this moment, I'm looking for library recommendations. (Side note: I'm a better php developer than other stacks, but I have node.js, some Angular and React experience, but this is a fun project, so I'd rather build it in something more modern / performant)."
"u/infinite__tsukuyomi","2 days ago","New to Web dev, quick question. How do y’all pick background colours for your web pages?","I’m working on a small web page (the recipe one from the Odin Project) and I’m having a tough time trying to decide what colours/ fonts to use. Any tips or tutorials y’all have related to the whole “artistic design” aspect of css?"
"u/agaitan026","2 days ago","Best headless cms for proyects with mysql database","Which headless cms you guys use for proyects that needs mysql databases?"
"u/feross","2 days ago","Luxury Retailer Farfetch Sees Higher Conversion Rates For Better Core Web Vitals","No description available"
"u/The_Poor_Jew","2 days ago","Should I use a rate limiter system in my case?","Say I have a feature on my website where I fetch user's data (e.g. they have an account on the website) like their networth, income etc. and I calculate a simple calculation, for simplicity I calculate income + networth. The calculation is just a simple JS function. So for the session, the user's data would be stored as some JS variable. Would I need a rate limiter system? It seems like even if there's a malicious user using this calculation function 10 times a second, this wouldn't really affect my system, right? Because as I understand, it wouldn't be fetching any data or calling any API (since there are no dependencies on this function, once the user's data is fetched for the session). Or am I wrong?"
"u/CookiesNCraem","2 days ago","Just bought a $150 ChromeBook, got free time and I hate myself. Convince me not to go on Freelancer right now. I'm so close.","Yeah, that's right. I got the cheapest laptop possible, running Linux Bullseye on a ChromeBook. I know Python, and enough web dev stuff to make Host Gator my bitch but I still can't figure out how to make my websites secure with TLS/SSL. Someone stop me from this path of self-destruction and irritation I'm about to begin."
"u/Thr0n_","2 days ago","How to disable double tap zoom","How should I disable double tap zoom in safari on ios? touch-action: manipulation; doesn't seem to do anything for me. I also don't like the idea of having a cooldown for touch events. Is there a better way of doing so?"
"u/TurgonTheKing","2 days ago","MySQL database or file storage for time-series data","Which one is better for time series? File storage or MySQL database? I have no other options because these are the options provided by my current webhosting service."
"u/pmdev1234","2 days ago","What technologies/how to develop a Web API on a Debian server?","I would like to develop an API on my Debian server so that when a user goes to http://mydomain.com/api/{number} , the system will return a JSON associated with number."
"u/NoCountryForThisMan","2 days ago","What is my best option for creating a site like this","Hi Everyone,"
"u/TrevorWoodham","2 days ago","(I hope this is allowed, Im not trying to self promote, only get a scope-of-work estimate like asking a contractor) If I wanted to make a functioning site like the demo linked in this image, would it be doable as an indie game studio? Or is this delusion of grandeur.","No description available"
"u/King1583","2 days ago","Need help choosing technologies","Looking to build a website for tourists all over the world. It's kinda my first ever deal as a freelancer. I'm having issues picking technologies to use."
"u/lovebunni833","2 days ago","I am looking for feedback from experienced developers and wanted to know if such a project is possible?","Microsoft will no longer support InfoPath forms by 2026. My organization has lots of InfoPath forms with SharePoint email workflows that are used for our process. SharePoint also has a list system where you can keep track of all requests and sort items for analysis purpose by admins."
"u/ScuzzyUltrawide","2 days ago","testing tool that kind of manages multiple incognitos or something? not sure precisely what I need","My webdev testing routines, when I really do them right, I have to pop open a bunch of incognitos and use 15+ different logins simultaneously, and it becomes cumbersome if not error-prone if not a fn nightmare. It would be nice if I could consolidate them in a tool of some kind. Something like my remote desktop manager but for web sessions. Maybe a chrome extension? Maybe a different browser that just handles it better? Kind of awkward for google searching too, not finding much. Is there a name for the class of tool I'm looking for maybe? Browser consolidator or something. All advice appreciated, thanks."
"u/PatrickRNG","2 days ago","Is 2FA an unbreakable solution regarding authentication? Are there any issues with it?","Title says it all. But I'm wondering what are the problems of an 2FA authentication method (if there are any), and maybe compare it to other authentication solutions."
"u/MaXxXiMuS613","2 days ago","VSCode WSL2 been working forever. Today it won't work (extremely slow spinning up)","-I also posted in /vscode- Thought there were more eyes here to give it a try. Not sure where else."
"u/litaci","2 days ago","can a section have a footer?","Well simple question, one of my colleagues said that a footer can only be used for a page but I think we can use <footer> where there is a content flow. Am I wrong?"
"u/KhazadTheBanBender","2 days ago","How can i open a text with js code?","i wanna design a button serie that when u click one of them it will show a paragraph on the empty side, with the different buttons it will show different topics in it. Which commands should i write and how to attach them to buttons?"
"u/mariuz","2 days ago","Do you still use Web SQL?","No description available"
"u/add-delay","2 days ago","CMS for super simple photoblog","What options are there around these days for running a very simple photoblog website?"
"u/MrRealWhiteWolf","2 days ago","Looking for a full time job but got an internship.","Hello Everyone,"
