"u/JosephCurvin","32 minutes ago","looking for Whiteboard like Miro Board for Coding","I recently tried Miro Board for displaying code and debugging and liked the visual approach. The problem is Miro board does not have Code Syntax highlighting. Can you recommend a whiteboard with miro features with syntax highlighting?"
"u/1257919478","35 minutes ago","VS plug-ins to match Webstorm?","Wanted to pick up VS code and get some experience in it. Any plug-ins suggestions for those coming from Webstorm? Looking for similar functionalities and more"
"u/Skyfall106","1 hour ago","I'm trying to make a hub of tools for web developers.","Hey Everyone,"
"u/joedev2","1 hour ago","What methods available are there for temporarily storing user's locations that update continuously and frequently?","Hello"
"u/DasEvoli","2 hours ago","Naming nested css classes","I'm having a hard time choosing names for classes.Is it bad practice to name nested classes like this (It's just an example)"
"u/Taltalonix","3 hours ago","Best approach to solving dynamic distance querying","I have a REST api (in django) that manages locations (stored in a longitude & latitude format). One of the queries I need to run is fetching the top N closest locations to the user’s coordinates provided."
"u/nickinkorea","3 hours ago","Hot single sass-marketing website in your area [Showoff Saturday]","Looking to A. Showoff, and B. receive critiques"
"u/Thepervysanin","3 hours ago","Someone please help me, even after hours of trying I don't know what I am doing wrong in the code. It's a website like tmdb that uses tmdb api , express and ejs. I am having issues rendering the page.","Basically the title, I'm trying to create a website like tmdb using tmdb api, this was for practicing https requests and working with api's and some ejs. I am getting the data from the api using"
"u/stefanjudis","3 hours ago","A CSS Previous Sibling Selector with :has()","No description available"
"u/nikhil_webfosters","3 hours ago","I made a report analysing 20,000 web3 jobs to find high paying jobs, most demanding jobs & more","Web3 jobs are exploding, every day we see some new web3 companies."
"u/elwingo1","4 hours ago","I built an open-source landing page for Tailwind CSS and Flowbite [MIT License]","No description available"
"u/ripvannwinkler","4 hours ago","What do you use for doc sites?","I've decided to start publishing an open source project, but I want to do the docs right. I love Tailwind's docs, but it appears they use Jigsaw, and I really don't want to set up a PHP stack for docs, as I don't use it for anything else. Ideally, I'm looking for a ""dive right in with very little customization"" tool, preferably based on markdown, but not necessarily."
"u/Berserkware","4 hours ago","I have finally finished my Python web framework named Waffleweb!","It is WSGI-Compatible, and also highly customizable. You can find it at https://berserkware.github.io/waffleweb."
"u/Vampire_developer","5 hours ago","Need some guidance working with APIs","I have recently learned basics of how to work with API."
"u/Not-Post-Malone","5 hours ago","How can I make a page with two columns where only one of the columns scrolls?","www.fruits.de is where I came across this technique. (You have to see it on a desktop to see what I’m talking about)"
"u/LazyGuy-_-","6 hours ago","Tomodoro: A pomodoro timer web app with Always On Top/PIP mode, without having to install any electron app!","No description available"
"u/LAN_scape","7 hours ago","I understand why everyone does not make tech start-ups now - New Years Resolution - Dev Log 36","I have had a proper 9-5 job for 3 weeks now. I now understand why most developers do not try to create tech start-ups all the time. After 8 hours of staring at a screen, I do feel that it is more difficult than before to get into the proper flow of things. With that on the table, I am still coding routinely and remember why my UI's are usually simple. Creating awesome animations and beautiful UI's on all screen sizes is difficult. Now that I have iterated twice over my website's home page UI, I am making the decision to dumb it down and make it simple like my last project. A simple UI done well looks better than a complex one done poorly any day of the week. I am particularly excited that I have outsourced my Hero image to Fivver. This time round no holds are barred. I will use a professionally made image instead one I found on Google."
"u/KingOfSpades4","9 hours ago","Why is it that my image turns darker when I make it a favicon? How do I fix this?","No description available"
"u/waduneck","10 hours ago","How hard would it be to create a video-chat-like app with a max room size of 2 people to scale to 100k-1m daily users assuming no other website logic?","g"
"u/Evalo01","11 hours ago","Examples of good documentation","I mostly do projects by myself so I haven’t had to learn how to create clear documentation that’s read by other developers (I’d mostly create it for myself)."
"u/boringblobking","12 hours ago","How much would it cost monthly to run a basic online store?","My friend had a shopify store that he was being charged £40/month for and he only had one item on the store. I was actually curious of two things, firstly, how much would it cost him to run (he got almost 0 traffic btw) if he created the website with code and used online hosting services, and secondly why is there no competitor to shopify offering the same service at a lower price as it probably costs them < £1 to run his site right?"
"u/inspirareVulpes","13 hours ago","Resources for web app security best practices","I want to learn the optimal ways for securing a web application as a developer, preventing things like XSS and SQL injection."
"u/iamchets","14 hours ago","Built a website to learn about smells through open source code bases","No description available"
"u/Jake_Zaruba","14 hours ago","What are some niches in web development jobs?","I’m curious about the niches that are out there within web development, aside from just general html/css/js jobs. Right now I’m focusing on Shopify. Has anyone found any others that have helped you land a job in such a saturated market?"
"u/Infinite_Ad_6137","14 hours ago","how to render data from backend? [NOOB]","Noob, and trying to make website with will show live wallpaper but, I wanna make my own database where I can fetch the videos and display, I am using react and SQL lite and nodejs and Also know python, it's like I can't render the data to front end and like I made render scripts but, I don't how to make its render and display over web, it's just I don't have knowledge or big brains,"
"u/bracesthrowaway","14 hours ago","Has anybody had code that ran the first time without any errors?","How did that feel?"
"u/SyrupStandard","15 hours ago","How does Freelancing work in regards to web development?","A few questions:"
"u/SleeperOfWomen","16 hours ago","I made a handy little guide to display:flex; properties in CSS (desktop only for now)","No description available"
"u/CowboyBoats","16 hours ago","Am I missing out on anything important by knowing fuck-all about Kibana?","For context for me personally, I'm a backend developer with 4 YoE, focusing primarily on Python and Django, and with enough command of JavaScript to be dangerous, maybe 80/20 full stack. But I wonder if there are others who have had this question. At both my current position and my previous position, there was a Kibana instance that I occasionally used, but I never really got to know it, because I never really had a reason to. Does Kibana play a prominent role in your workflow? What does it help you accomplish?"
"u/isotropicdesign","16 hours ago","How to Make Snapping Scroll Sections with CSS Scroll-Snap (fullpage.js alternative) - Isotropic","No description available"
"u/xTheBear","18 hours ago","Change title in Tomcat","I'm trying to figure out how to change the <title> attribute of my site (running ubuntu, with tomcat9). I cannot find any file that has the string of text that the title currently displays. Any ideas?"
"u/Mr-Invincible3","19 hours ago","looking for a complex app","Hello everyone, i wanted ask if there is any open source complex app on github that i could learn from. Im looking for an app that has all the new complex features like creating post, chatrooms, video calls, media sharing, maybe screen sharing, builtin custom emojis etc. Im somewhat decent at programming so want to enhance them by studying other applications."
"u/Thunt4jr","20 hours ago","Really? $32,000 a year!","No description available"
"u/CaptainLofi600","21 hours ago","CMS with Arabic/RTL support","Hi there folks!"
"u/Ultra_HR","21 hours ago","Front end frameworks: why do they make me feel so stupid?","I have tried dozens of times to get my head around front end frameworks like React, Vue, Svelte etc. Either by following YouTube tutorials, or written guides, or by actually using the official documentation and trying to follow the examples in those, and no matter what I always feel like I am missing something, and stumble at a very early hurdle. Basic stuff like how to create components and link them together and call them from other places - or even simpler, more early-stage things like structuring the project, or thinking about how it might be deployed for testing - all of these things totally flummox me."
"u/speckz","21 hours ago","CSS Gradient Generator - Make and generate beautiful gradients","No description available"
"u/speckz","21 hours ago","The browser console has a count method","No description available"
"u/jealousmonk88","21 hours ago","Using Node/express and server side rendering, how do I send browser localStorage data back to server and also render a page with that data without saving to database?","A browser can only make a get request from the url bar. I can send data back to server from client side using axios via req.body with javascript but the browser can't do that when someone puts in that url. So how do I both render the view of that url AND use the data from browser localStorage that gets sent back but without saving that data into database first?"
"u/magenta_placenta","22 hours ago","How I Experience the Web Today","No description available"
"u/CstoCry","22 hours ago","What type of web design is this called? It's one of the best I've ever seen!","I was blown away by this incredible piece of work made by Riot Games for their new Star Guardian Event."
"u/Notalabel_4566","1 day ago","Does anyone know templates, websites, or books for how to make proper documentation?","Does anyone know websites or books where there are examples or premade templates?"
"u/SkeletonBrute_487","1 day ago","Memeracle","I made a meme generator using React! Check it out: https://memeracle.vercel.app"
"u/DiddlyDanq","1 day ago","Best approach to handling user vote refreshing on millions of pages","Im building a website using nextjs where uses can vote on items. Im wondering what is the best approach to implementing this how this vote data is refreshed. I gather I can either:"
"u/iamqaz","1 day ago","Create a simple cookie with Remix","No description available"
"u/Neutral_funk98","1 day ago","Suggest me websites to build for a training center","Hi everyone,"
"u/__sys_out_println__","1 day ago","How to configure an HTTP resource/API endpoint to only be accessible to a specific single page app?","I may be having a brain fart or something, but if I have an API at example.com/analytics, using CORS I can configure it to only be accessible by my specific site — e.g. hello-world.com."
"u/alexmacarthur","1 day ago","christian-git: sanctify your version control workflow.","No description available"
"u/FloppyFluffyEars","1 day ago","Is it possible to alter the HTML of a page and send it to someone and they would be able to see the altered version of the page rather than the original one?","Like if I fiddled around with the HTML of Wikipedia and changed the name to""Cool-Pedia"" . The server still has it as Wikipedi so if I just send the link to a friend they will still see the name Wikipedia. Is there a way to change it to Cool-Pedia, send the link to a friend and have it still be Cool-Pedia rather than Wikipedia?"
"u/Ok_Investigator_1010","1 day ago","Issues with my flask app","For some reason my flask app has been having issues recently with loading changes to my htlm pages. I’ve saved my pages and made sure to check my spelling when rendering_templates. But alas for some reason the pages won’t load up the correct file."
"u/raulalexo99","1 day ago","Got my first web dev client. How can I show them my progress?","Whats the norm when you have to show clients your progress? Like, how do you do it?"
"u/ItsPoofy","1 day ago","experience vs portfolio design vs portfolio pieces","For recruiters or developers that have had alot of success in the development job market."
"u/TychaBrahe","1 day ago","How do I create tables in WordPress?","When searching for information on making tables in WordPress, I get references to displaying data from SQL queries. That's not what I want. I want organized information in rows and columns."
"u/FurryLarper69","1 day ago","Netlify Analytics: Am I right to assume that bots are trying to access these ""Top resources not found""?","No description available"
"u/range_et","1 day ago","What is the proper way of bundling in node dependencies with rollup?","Hi! So I was trying to bundle in a bunch of external package dependencies using roll-up, like three JS and deck.gl. Right now I have a rollup config file set up like so, one to build just the code I have written and another that bundles in all the dependencies :"
"u/og-at","1 day ago","Having a layered promise problem with Firestore, and array comes out [Promise]","First of all, the learning path I had a couple years ago completely ignored promises. They used Axios to do fetching duties at a time when async/await was already very much a thing."
"u/DavidWest2000","1 day ago","Choosing a domain hosting provider","I used HostGator to register a couple Domaine names. I didn't pay the $100 it would cost for privacy guard. Now I have to change cell phone providers because my name, cell and home address are on the web. I have gotten 20 spam calls and 10 spam texts, just today. There are other Domaine providers that care about privacy and give it you automatically (I was seeing NameCheap does)."
"u/SpaceParmesan","1 day ago","Scrolling only works when at the very top of the page","I have a nav bar that I want to be able to click and scroll to that section of the page, however it only works on I am scrolled all the way to the top. Otherwise, clicking the nav bar will jump to the very top of the page."
"u/pigeon-chest","1 day ago","Flask Google oauth code letting me sign in and out, but unable to switch to a different user (google account). It just assumes the same user even when I do session.clear() or restart my computer.","I've been using the code from the authlib github: https://github.com/authlib/demo-oauth-client/blob/master/flask-google-login/app.py to make a google oauth login system for my software I'm building. It works to sign me in using my google account, however it always assumes that same account and gives me no option to switch users. Does anyone know how to sign out for real or switch users with flask google oauth?"
"u/Gmuylen","1 day ago","Simple CMS, that can work with HTML and CSS files just for editing text.","Is there anything like it that exists?"
"u/forever-transitional","1 day ago","specializing vs fullstack","I am pretty comfortable with front end development, but it seems these days that people more tend to do everything, at my last job we hired a new manager who very clearly was pushing all devs to be fullstack, which made me pretty uncomfortable because I find that it takes all of my effort to be ""good"" at just front end development, and I know that my work would suffer greatly if I was forced to do everything. Is it feasible to focus just on front end development these days? do companies often hire devs who specialize?"
"u/duskick","1 day ago","Database CRUD + dashboard stack advice","Problem: Looking for some advice on what stack I should be using to generate a database CRUD web interface (nice user input/display screens + some overview dashboards with tables, graphs, etc.) for my MSSQL database. I feel like I'm running in circles trying to choose the ""perfect"" backend/frontend frameworks for this or that portion and I am in ""analysis paralysis"" mode."
"u/divjbobo","1 day ago","Can I store session id in cookie if it's not being used for authentication - but rather 'progress tracking'?","Context:"
"u/corycorycory09","1 day ago","Best practice / libraries for maintaining local cache synchronization with REST?","I've recently been learning GraphQL along with the Apollo client. While I have certain things I dislike about Apollo, one of the features I found to be quite interesting is how it handles it's local cache."
"u/Adventurous_Prior_96","1 day ago","how to achieve this animations","No description available"
"u/feross","1 day ago","Release Notes for Safari Technology Preview 149","No description available"
"u/AKing2713","1 day ago","Are Web Dev and SWE jobs one in the same?","I’m currently in a data science roll and looking to expand my skill set in order to maybe transition to one of these rolls in the future. After looking at some job titles and the required skills it seems like the vast majority of jobs are aimed towards Web Dev even if their job title begs to differ."
"u/Jay087","1 day ago","Zoom on scroll?","I tried to make a simple effect, when the user scrolls, the background image just zooms a bit, while the text fades but I can not achieve this. Can someone please help me? (i am a beginner). I try to do it with jQuery but had no luck, the same goes for JS."
"u/doa-doa","1 day ago","How to use Fetch?","I'm trying to run this on the Repl but I don't know how to fix the error. I'm trying to learn fetch and api stuff can anybody help?"
"u/CaptainStack","1 day ago","I created an unopinionated and flexible Gatsby starter template for simple static sites. Feedback requested!","No description available"
"u/jealousmonk88","1 day ago","Using express, why does a router.use(function) cause two requests every time?","I have in app.js app.use('/', viewRouter);"
"u/sk8rboi7566","1 day ago","Possible Phishing Scam?","Had a recruiter call out to go over job description. Then followed up email asking for my resume. Sent them a PDF version of the resume."
"u/joeswansonx69x","1 day ago","CSS when to use class vs chaining selectors","For example, should I use .login-form-button or .login-form button? What are the general guidelines?"
"u/cstobler","1 day ago","Anyone here use a subscription-based model for web development services?","I'm looking to get back into Web Development after a short stint working another job, and I am noticing more and more that there are web development companies charging by the month rather than charging upfront for the whole project. In the case of websites, it would be a monthly fee that covers everything, including maintenance, hosting, etc."
"u/chickenbabies","1 day ago","Is PHP native in browsers?","does it get transpiled to JS language or is it natively supported?"
"u/hardonchairs","1 day ago","Can I force immutable document.domain now to test its impacts?","https://developer.chrome.com/blog/immutable-document-domain/?utm_source=devtools"
"u/Temporary-Drawing212","1 day ago","Issue with Bootstrap dropdown not collapsing","I am creating my first bootstrap 5 web page. I have three links in my nav: Home, Shop and About us. My shop link has a drop down to showcase the categories they can pick from when shopping here. The issue I am having is that the dropdown will no collapse. I had this same issue with the navbar toggle button. Even after I copied and pasted the exact code Bootstrap 5 gives you in their doc. Anything related to toggling a collapse will not work."
"u/zephimir","1 day ago","Tauri 1.0 has launched!","No description available"
"u/Frisky_Mint","1 day ago","Google displays page that requires a parameter","I have a page on a site that requires a query parameter in order to return any data. Google is displaying this page on search results without a query parameter, basically just sending the user to a 404. Any suggestions how to fix this?"
"u/little-rabbitO-O","1 day ago","looking for a (drag'n'drop) website builder with code export and no third/external ressources","first of all: my goal is just a simple one-site, but fancy website about a project without any database in background (like wordpress works IIRC). Just simply the (exported) code to host it with nginx"
"u/roleparadise","1 day ago","Best way to implement passwordless authentication?","I'm looking to implement authentication that employs email and SMS magic links /pass codes to log users in."
"u/userknownunknown","1 day ago","I want to make something real and useful...","Ok, the title isn't great, but it's also a representation of my state of mind right now... I started learning web dev 2 years ago and got really good with both the frontend and backend and can make most types of websites out there. However, I've been mostly making practice projects and although I complete every project I start, it has gotten very dull, to the point that I don't even want to sit at the computer(ok a little exaggeration, but still true). I want to make something useful and also profitable to get some motivation to keep doing stuff. I've tried Fiverr etc.. but no luck at all from those sites. I wanted to just put it out here so that people more senior/experienced than me could help me out."
"u/feross","1 day ago","DevTools Tips: How to emulate CSS user preference media features with DevTools","No description available"
"u/tbantle","1 day ago","Implementing a support ticket system on our website with AWS Incident Manager","No description available"
"u/red_blue98","1 day ago","I am not contributing anything to my new team, any advice?","So a couple of months ago I started at my first job, the first month was amazing I joined a team working on an internal application and after getting onboarded was able to make some fairly good contributions. They were good enough that I got assigned to a new team as a shadow."
"u/hjude_design","1 day ago","The difference between device types in dev tools?","In browser dev tools theres a dropdown menu that lets you pick between Mobile, Mobile (no Touch), Desktop, Desktop (no Touch), but what exactly is the difference between them?"
"u/safaribrowserram","1 day ago","What's the best way to allow users edit content on my documentation-like website?","I have a website which is very similar to a documentation website. The content is stored in MDX. There are lot of CMSs I can look into, but I specifically wondering about the MDX part. This means that some pages have React components or JSX syntax and import statements."
"u/dneal12","1 day ago","Any APIs that has book series information","I want to take a book, and look up if it belongs to a series. If it belongs to a series, I then want to lookup all the titles in that series. I cannot find an API that has this data and was wondering if anyone know if there is one."
"u/xdqz","1 day ago","Confused about authentication","I think I understand how user authentication is done through sessions when your backend and frontend are a single app. However, how are things done when your backend and frontend are separated? Do you have to protect the backend api? Or does the frontend manage the users somehow, and the backend is open (but only reachable by the frontend)?"
"u/j2ee-123","1 day ago","TDD is it worth it?","For those devs who are using TDD, what's the catch? Is it worth it?"
"u/maxoys45","1 day ago","What's the correct setup for GTM and GA?","At my company, the GTM/GA setup is all over the place which is making it hard for me (who's not hugely knowledgeable when it comes to this side of things) to figure out how it should be setup."
"u/jssmith42","1 day ago","Open a website at localhost","I am trying to create a script that automates annotating web pages."
"u/wholelotofit2","1 day ago","Should I buy used Macbook for web development?","Hey all,"
"u/deadcoder0904","1 day ago","How do I make Design Templates like Canva Templates that are unique but can be modified & exported as an image? Should I use Canvas or WebGL?","Canva has Templates that are unique & can be easily modified by anyone & replaced with their own text, images, etc..."
"u/darkshifty","1 day ago","Simple data manipulation, frontend or backend?","Recently my backend colleague stated all data coming from the backend should be a set of data ready for the frontend. i.e. a simple list with signed up and available tasks should suffice. This while I see gains in manipulating the two lists(subscribed tasks and available tasks) in the users browser. What is your thought on this and where do you draw the line?"
"u/mohsinali-","1 day ago","Is it safe to upload file directly from frontend to AWS S3?","By using the signed url we can upload a file directly from frontend / client to aws s3 .How secure is it.?How can I got hacked.?What are the tips to prevent hacking.?"
"u/Substantial_Gift_861","1 day ago","in mega.nz, when i download something, it has this kind of this loading the download file, and after finish loading, then it will show the downloaded file at bottom of chrome browser. How to do it? using javascript library to do it?","No description available"
"u/cleatusvandamme","1 day ago","Has anyone used Scimba to learn React.js","I'm debating about getting a Scrimba membership to help me learn React.js. I was curious if anyone here has used it. It seems to have good reviews."
"u/prog_22","1 day ago","Is there an annotated version of vue 2 source code?","Similar to how jquery code has been annotated"
