"u/jealousmonk88","2 days ago","Is it a good idea to store product data in HTML to avoid an extra database query?","I am thinking of storing a product's information on the main browsing page. It's a gallery of like 20 products. It's generated from a mongodb query. After this, if the client clicks on a product, it will go to that product's page. Only the product's database id is passed into request. Right now I have another query on that page to get the product and only the product's database id. It seems I can avoid this extra query if I store all the product's data on the browsing page itself. Then send the product's information through req. I'm doing server side rendering with pug so it gets the req.body and renders the page and sends to client."
"u/Flyharbour","2 days ago","Could somebody recommend a library to achieve this?","Hi There, could anybody recommend me a library for React that can handle this kind of movement of list item? Does anybody actually know what this behaviour is actually called?"
"u/ishkk","3 days ago","Recursive function time complexity","The time complexity of below problem should be O(1) according to me as the worst case will be constant probably log base 2 1000, but the answer is given as O(n). What am i thinking wrong?"
"u/speckz","3 days ago","Random Favicon Generator - Select a beautiful random favicon from a set of over 1950 MIT-licensed, free, awesome Tabler icons set. Choose colors, stroke width, and other styling properties to give a custom and unique look and feel.","No description available"
"u/speckz","3 days ago","Blob Animation | Generate smooth blob animation","No description available"
"u/feross","3 days ago","What's New In DevTools (Chrome 104)","No description available"
"u/speckz","3 days ago","The Future of CSS: Variable Units, powered by Custom Properties","No description available"
"u/JennyC05","3 days ago",".com v/s .in","We have market places in US as well as IN. The website is based on Shopify."
"u/noiseymur","3 days ago","Thanks to the new chair I bought, half of my problems as a developer are gone. Sometimes it's not the code.","One of the best investments you can make as a developer."
"u/ShossTheBoss","3 days ago","How to change color of text when a div begins to overlap it?","Hi all, I have a black-background div that is animated on the page, and what I would like to achieve is an effect where when it overlaps my black text, the text becomes white"
"u/JosephCY","3 days ago","Fastest managed DNS service in terms of (perf/cost)(no cloudflare please)?","Was previously using Digital Ocean free DNS but sadly their free DNS isn't using anycast, I ran a benchmark with dnsperf speed benchmark tool and notice in some region they're quite slow."
"u/ab-azure","3 days ago","Counting in CSS: Unlock magic of CSS variables","No description available"
"u/tengenbypass","3 days ago","What is the proper way to handle displaying 10,000 results?","No description available"
"u/FilC619","3 days ago","WordPress Default style overrides CSS written in the page","This is what I see in inspect."
"u/mostknowndeveloper","3 days ago","Is there any way to post here using google api?","No description available"
"u/touhulan_mato","3 days ago","Switching from Bootstrap & SCSS to Tailwind CSS","Has anyone here made this change? How did it go?"
"u/Rounak_Topdar","3 days ago","My tailwind classes are not working for some reason, need help","I am learning Tailwind CSS from net ninja in YT. I have followed all the steps needed to install and set up tailwind using node package manager. However, none of the utilities that I am writing in the HTML page is being reflected on the final product for some reason."
"u/alittlehotcurry","3 days ago","How do you find inspiration to start a new project ??","The current project I am working on feels monotonous, for the longest time we been resolving a similar array of issues and I feel the project is not challenging/exciting me for most part. I am looking to switch altogether but due to constraints mostly personal I am not. However, in my free time I do brainstorm ideas that I can turn into a product or service but most of these side projects end up not getting finished either I find a better idea and immediately jump to that or it requires me writing a lot of boiler plate stuff just to get to the interesting bits of the project plus some of the projects I do are basically me mimicking or closely related to my work projects as in add some functionality to them or maybe come up with a better UI or using a different set of stack to build it."
"u/TD_Maokli","3 days ago","AngularJS - Limit consecutive API calls","Hi everyone,I have an AngularJS app, and a button that adds an object to an array, then send that array in the body of a response, I want that if a user presses on the button many times, I only execute the last API call since it will have all the elements in the array already.I can think of ways to do this, but are there best practices to do this in AngularJS?"
"u/mumchay","3 days ago","Springboot multitenancy","Hi, I'm currently working on a springboot/angular app. I want to implement multitenancy for this app. The problem is that the backend is composed of multiple microservices (which use oauth2/tokens for authentication). I have a authentication/users microservice on which I would like to implement shared db, shared schema multitenancy, then I would like to implement shared db, schema not shared multitenancy for the other microservices. So I would like to know if this is doable or not. Also, do you have any tips? Thanks?"
"u/Seaweed_Widef","3 days ago","Build my first full stack application (JWT-authentication) following the net ninja course playlist. And first time deploying on HEROKU","No description available"
